{
  "$schema": "../../../../../contracts/tool.manifest.schema.json",
  "tool_key": "data-secure-manage",
  "display_name": "数据安全治理工具",
  "feature_slugs": [
    "project-spaces",
    "project-spaces/delete",
    "suggest-identifier-key",
    "questionnaire/questions",
    "questionnaire/questions/delete",
    "questionnaire/questions/delete",
    "relevance-rule",
    "relevance-assessments",
    "lifecycle-field-config",
    "field-catalog",
    "field-requests",
    "business-function-options",
    "business-function-option-requests",
    "field-usage-reports",
    "classification-matrix",
    "classification-matrix/delete",
    "classification-rules",
    "classification-rules/delete",
    "classification-recompute",
    "classification-results",
    "classification-manual-override",
    "classification-revert-auto",
    "classification-audit",
    "classification-export",
    "taxonomy-nodes",
    "taxonomy-nodes/delete",
    "field-class-grade",
    "field-security-requirements",
    "field-security-requirements/delete",
    "field-security-requirements-eval"
  ],
  "behavior_catalog": [
    { "key": "project-spaces", "label": "数据安全治理：项目空间管理" },
    { "key": "project-spaces/delete", "label": "数据安全治理：删除项目空间" },
    { "key": "suggest-identifier-key", "label": "数据安全治理：标识自动生成" },
    { "key": "questionnaire/questions", "label": "数据安全治理：问卷题目管理" },
    { "key": "questionnaire/questions/delete", "label": "数据安全治理：删除问卷题目" },
    { "key": "questionnaire/questions/delete", "label": "数据安全治理：删除问卷题目" },
    { "key": "relevance-rule", "label": "数据安全治理：相关性判定规则" },
    { "key": "relevance-assessments", "label": "数据安全治理：相关性判定填报" },
    { "key": "lifecycle-field-config", "label": "数据安全治理：填报表单字段配置" },
    { "key": "field-catalog", "label": "数据安全治理：数据字段主表" },
    { "key": "field-requests", "label": "数据安全治理：数据字段新增申请" },
    { "key": "business-function-options", "label": "数据安全治理：业务功能选项查询" },
    { "key": "business-function-option-requests", "label": "数据安全治理：业务功能选项申请与审核" },
    { "key": "field-usage-reports", "label": "数据安全治理：数据字段填报与导出" },
    { "key": "classification-matrix", "label": "数据安全治理：显式分类矩阵" },
    { "key": "classification-matrix/delete", "label": "数据安全治理：删除显式分类矩阵" },
    { "key": "classification-rules", "label": "数据安全治理：分类分级规则" },
    { "key": "classification-rules/delete", "label": "数据安全治理：删除分类分级规则" },
    { "key": "classification-recompute", "label": "数据安全治理：分类分级重算" },
    { "key": "classification-results", "label": "数据安全治理：分类分级结果查询" },
    { "key": "classification-manual-override", "label": "数据安全治理：分类分级人工覆写" },
    { "key": "classification-revert-auto", "label": "数据安全治理：分类分级恢复自动" },
    { "key": "classification-audit", "label": "数据安全治理：分类分级审计记录" },
    { "key": "classification-export", "label": "数据安全治理：分类分级结果导出" },
    { "key": "taxonomy-nodes", "label": "数据安全治理：分类分级和要求治理（Level1/2 分类树）" },
    { "key": "taxonomy-nodes/delete", "label": "数据安全治理：删除分类节点" },
    { "key": "field-class-grade", "label": "数据安全治理：数据字段分类分级（密级）" },
    { "key": "field-security-requirements", "label": "数据安全治理：数据字段安全要求" },
    { "key": "field-security-requirements/delete", "label": "数据安全治理：删除数据字段安全要求" },
    { "key": "field-security-requirements-eval", "label": "数据安全治理：安全要求逻辑求值" }
  ],
  "frontend": {
    "detail_panel_module": "DataSecureManagePanel",
    "manage_tab_modules": [
      {
        "name": "data-secure-governance",
        "label": "数据安全治理",
        "module": "DataSecureManageManageTab"
      }
    ]
  }
}
